{"componentChunkName":"component---src-lekoarts-gatsby-theme-minimal-blog-core-templates-post-query-tsx","path":"/refcards","result":{"data":{"mdx":{"slug":"refcards/","tableOfContents":{"items":[{"url":"#summary","title":"Summary"},{"url":"#functional-programming-in-javascript","title":"Functional Programming in JavaScript"},{"url":"#functional-programming-with-clojure","title":"Functional Programming with Clojure"},{"url":"#understanding-cloud-computing","title":"Understanding Cloud Computing"},{"url":"#design-systems","title":"Design systems"},{"url":"#getting-started-with-docker","title":"Getting Started With Docker"},{"url":"#getting-started-with-microservices","title":"Getting Started With Microservices"},{"url":"#nodejs","title":"Node.js"}]}},"post":{"__typename":"MdxPost","slug":"/refcards","title":"Ref cards on DZone","date":"12.12.2020","tags":[{"name":"refcard","slug":"refcard"},{"name":"dzone","slug":"dzone"}],"body":"function _extends() { _extends = Object.assign || function (target) { for (var i = 1; i < arguments.length; i++) { var source = arguments[i]; for (var key in source) { if (Object.prototype.hasOwnProperty.call(source, key)) { target[key] = source[key]; } } } return target; }; return _extends.apply(this, arguments); }\n\nfunction _objectWithoutProperties(source, excluded) { if (source == null) return {}; var target = _objectWithoutPropertiesLoose(source, excluded); var key, i; if (Object.getOwnPropertySymbols) { var sourceSymbolKeys = Object.getOwnPropertySymbols(source); for (i = 0; i < sourceSymbolKeys.length; i++) { key = sourceSymbolKeys[i]; if (excluded.indexOf(key) >= 0) continue; if (!Object.prototype.propertyIsEnumerable.call(source, key)) continue; target[key] = source[key]; } } return target; }\n\nfunction _objectWithoutPropertiesLoose(source, excluded) { if (source == null) return {}; var target = {}; var sourceKeys = Object.keys(source); var key, i; for (i = 0; i < sourceKeys.length; i++) { key = sourceKeys[i]; if (excluded.indexOf(key) >= 0) continue; target[key] = source[key]; } return target; }\n\n/* @jsxRuntime classic */\n\n/* @jsx mdx */\nvar _frontmatter = {\n  \"title\": \"Ref cards on DZone\",\n  \"date\": \"2020-12-12T00:00:00.000Z\",\n  \"slug\": \"/refcards\",\n  \"tags\": [\"refcard\", \"dzone\"]\n};\nvar layoutProps = {\n  _frontmatter: _frontmatter\n};\nvar MDXLayout = \"wrapper\";\nreturn function MDXContent(_ref) {\n  var components = _ref.components,\n      props = _objectWithoutProperties(_ref, [\"components\"]);\n\n  return mdx(MDXLayout, _extends({}, layoutProps, props, {\n    components: components,\n    mdxType: \"MDXLayout\"\n  }), mdx(\"p\", null, mdx(\"a\", _extends({\n    parentName: \"p\"\n  }, {\n    \"href\": \"https://en.wikipedia.org/wiki/Reference_card\"\n  }), \"Refcard\"), \" is a collection of brief notes on a specific topic to aid in memorization.\"), mdx(\"p\", null, \"I have found a few useful refcards on the \", mdx(\"a\", _extends({\n    parentName: \"p\"\n  }, {\n    \"href\": \"https://dzone.com/refcardz\"\n  }), \"DZone\"), \" website.\\nI have listed here just the popular ones and the ones I'm interested in. You can find out more on the official website.\"), mdx(\"h2\", {\n    \"id\": \"summary\",\n    \"style\": {\n      \"position\": \"relative\"\n    }\n  }, mdx(\"a\", _extends({\n    parentName: \"h2\"\n  }, {\n    \"href\": \"#summary\",\n    \"aria-label\": \"summary permalink\",\n    \"className\": \"anchor before\"\n  }), mdx(\"svg\", _extends({\n    parentName: \"a\"\n  }, {\n    \"aria-hidden\": \"true\",\n    \"focusable\": \"false\",\n    \"height\": \"16\",\n    \"version\": \"1.1\",\n    \"viewBox\": \"0 0 16 16\",\n    \"width\": \"16\"\n  }), mdx(\"path\", _extends({\n    parentName: \"svg\"\n  }, {\n    \"fillRule\": \"evenodd\",\n    \"d\": \"M4 9h1v1H4c-1.5 0-3-1.69-3-3.5S2.55 3 4 3h4c1.45 0 3 1.69 3 3.5 0 1.41-.91 2.72-2 3.25V8.59c.58-.45 1-1.27 1-2.09C10 5.22 8.98 4 8 4H4c-.98 0-2 1.22-2 2.5S3 9 4 9zm9-3h-1v1h1c1 0 2 1.22 2 2.5S13.98 12 13 12H9c-.98 0-2-1.22-2-2.5 0-.83.42-1.64 1-2.09V6.25c-1.09.53-2 1.84-2 3.25C6 11.31 7.55 13 9 13h4c1.45 0 3-1.69 3-3.5S14.5 6 13 6z\"\n  })))), \"Summary\"), mdx(\"table\", null, mdx(\"thead\", {\n    parentName: \"table\"\n  }, mdx(\"tr\", {\n    parentName: \"thead\"\n  }, mdx(\"th\", _extends({\n    parentName: \"tr\"\n  }, {\n    \"align\": null\n  }), \"ID\"), mdx(\"th\", _extends({\n    parentName: \"tr\"\n  }, {\n    \"align\": null\n  }), \"Title\"), mdx(\"th\", _extends({\n    parentName: \"tr\"\n  }, {\n    \"align\": null\n  }), \"Author\"), mdx(\"th\", _extends({\n    parentName: \"tr\"\n  }, {\n    \"align\": null\n  }), \"Published\"))), mdx(\"tbody\", {\n    parentName: \"table\"\n  }, mdx(\"tr\", {\n    parentName: \"tbody\"\n  }, mdx(\"td\", _extends({\n    parentName: \"tr\"\n  }, {\n    \"align\": null\n  }), mdx(\"a\", _extends({\n    parentName: \"td\"\n  }, {\n    \"href\": \"https://dzone.com/refcardz/functional-programming-with-javascript?chapter=1\"\n  }), \"217\")), mdx(\"td\", _extends({\n    parentName: \"tr\"\n  }, {\n    \"align\": null\n  }), \"Functional Programming in JavaScript\"), mdx(\"td\", _extends({\n    parentName: \"tr\"\n  }, {\n    \"align\": null\n  }), \"Luis Atencio\"), mdx(\"td\", _extends({\n    parentName: \"tr\"\n  }, {\n    \"align\": null\n  }), \"Oct. 04, 2015\")), mdx(\"tr\", {\n    parentName: \"tbody\"\n  }, mdx(\"td\", _extends({\n    parentName: \"tr\"\n  }, {\n    \"align\": null\n  }), mdx(\"a\", _extends({\n    parentName: \"td\"\n  }, {\n    \"href\": \"https://dzone.com/refcardz/functional-programming-clojure?chapter=1\"\n  }), \"122\")), mdx(\"td\", _extends({\n    parentName: \"tr\"\n  }, {\n    \"align\": null\n  }), \"Functional Programming with Clojure\"), mdx(\"td\", _extends({\n    parentName: \"tr\"\n  }, {\n    \"align\": null\n  }), \"Tim Berglund, Matthew McCullough\"), mdx(\"td\", _extends({\n    parentName: \"tr\"\n  }, {\n    \"align\": null\n  }), \"Oct. 31, 2010\")), mdx(\"tr\", {\n    parentName: \"tbody\"\n  }, mdx(\"td\", _extends({\n    parentName: \"tr\"\n  }, {\n    \"align\": null\n  }), mdx(\"a\", _extends({\n    parentName: \"td\"\n  }, {\n    \"href\": \"https://dzone.com/refcardz/getting-started-cloud\"\n  }), \"082\")), mdx(\"td\", _extends({\n    parentName: \"tr\"\n  }, {\n    \"align\": null\n  }), \"Understanding Cloud Computing\"), mdx(\"td\", _extends({\n    parentName: \"tr\"\n  }, {\n    \"align\": null\n  }), \"David Posin, Daniel Rubio\"), mdx(\"td\", _extends({\n    parentName: \"tr\"\n  }, {\n    \"align\": null\n  }), \"Mar. 15, 2017\")), mdx(\"tr\", {\n    parentName: \"tbody\"\n  }, mdx(\"td\", _extends({\n    parentName: \"tr\"\n  }, {\n    \"align\": null\n  }), mdx(\"a\", _extends({\n    parentName: \"td\"\n  }, {\n    \"href\": \"https://dzone.com/refcardz/design-systems-1\"\n  }), \"281\")), mdx(\"td\", _extends({\n    parentName: \"tr\"\n  }, {\n    \"align\": null\n  }), \"Design systems\"), mdx(\"td\", _extends({\n    parentName: \"tr\"\n  }, {\n    \"align\": null\n  }), \"George Abraham\"), mdx(\"td\", _extends({\n    parentName: \"tr\"\n  }, {\n    \"align\": null\n  }), \"Dec. 20, 2018\")), mdx(\"tr\", {\n    parentName: \"tbody\"\n  }, mdx(\"td\", _extends({\n    parentName: \"tr\"\n  }, {\n    \"align\": null\n  }), mdx(\"a\", _extends({\n    parentName: \"td\"\n  }, {\n    \"href\": \"https://dzone.com/refcardz/getting-started-with-docker-1\"\n  }), \"221\")), mdx(\"td\", _extends({\n    parentName: \"tr\"\n  }, {\n    \"align\": null\n  }), \"Getting Started With Docker\"), mdx(\"td\", _extends({\n    parentName: \"tr\"\n  }, {\n    \"align\": null\n  }), \"Christopher M. Judd\"), mdx(\"td\", _extends({\n    parentName: \"tr\"\n  }, {\n    \"align\": null\n  }), \"Aug. 22, 2017\")), mdx(\"tr\", {\n    parentName: \"tbody\"\n  }, mdx(\"td\", _extends({\n    parentName: \"tr\"\n  }, {\n    \"align\": null\n  }), mdx(\"a\", _extends({\n    parentName: \"td\"\n  }, {\n    \"href\": \"https://dzone.com/refcardz/getting-started-with-microservices\"\n  }), \"215\")), mdx(\"td\", _extends({\n    parentName: \"tr\"\n  }, {\n    \"align\": null\n  }), \"Getting Started With Microservices\"), mdx(\"td\", _extends({\n    parentName: \"tr\"\n  }, {\n    \"align\": null\n  }), \"Andy Hampshire\"), mdx(\"td\", _extends({\n    parentName: \"tr\"\n  }, {\n    \"align\": null\n  }), \"Aug. 01, 2019\")), mdx(\"tr\", {\n    parentName: \"tbody\"\n  }, mdx(\"td\", _extends({\n    parentName: \"tr\"\n  }, {\n    \"align\": null\n  }), mdx(\"a\", _extends({\n    parentName: \"td\"\n  }, {\n    \"href\": \"https://dzone.com/refcardz/nodejs?chapter=1\"\n  }), \"141\")), mdx(\"td\", _extends({\n    parentName: \"tr\"\n  }, {\n    \"align\": null\n  }), \"Node.js\"), mdx(\"td\", _extends({\n    parentName: \"tr\"\n  }, {\n    \"align\": null\n  }), \"Justin Albano, Dave Whiteley\"), mdx(\"td\", _extends({\n    parentName: \"tr\"\n  }, {\n    \"align\": null\n  }), \"Feb. 20, 2018\")))), mdx(\"h2\", {\n    \"id\": \"functional-programming-in-javascript\",\n    \"style\": {\n      \"position\": \"relative\"\n    }\n  }, mdx(\"a\", _extends({\n    parentName: \"h2\"\n  }, {\n    \"href\": \"#functional-programming-in-javascript\",\n    \"aria-label\": \"functional programming in javascript permalink\",\n    \"className\": \"anchor before\"\n  }), mdx(\"svg\", _extends({\n    parentName: \"a\"\n  }, {\n    \"aria-hidden\": \"true\",\n    \"focusable\": \"false\",\n    \"height\": \"16\",\n    \"version\": \"1.1\",\n    \"viewBox\": \"0 0 16 16\",\n    \"width\": \"16\"\n  }), mdx(\"path\", _extends({\n    parentName: \"svg\"\n  }, {\n    \"fillRule\": \"evenodd\",\n    \"d\": \"M4 9h1v1H4c-1.5 0-3-1.69-3-3.5S2.55 3 4 3h4c1.45 0 3 1.69 3 3.5 0 1.41-.91 2.72-2 3.25V8.59c.58-.45 1-1.27 1-2.09C10 5.22 8.98 4 8 4H4c-.98 0-2 1.22-2 2.5S3 9 4 9zm9-3h-1v1h1c1 0 2 1.22 2 2.5S13.98 12 13 12H9c-.98 0-2-1.22-2-2.5 0-.83.42-1.64 1-2.09V6.25c-1.09.53-2 1.84-2 3.25C6 11.31 7.55 13 9 13h4c1.45 0 3-1.69 3-3.5S14.5 6 13 6z\"\n  })))), \"Functional Programming in JavaScript\"), mdx(\"p\", null, mdx(\"strong\", {\n    parentName: \"p\"\n  }, \"The Functional Paradigm in a Familiar Language\")), mdx(\"p\", null, \"Explains functions, data types, and techniques to demonstrate the functional paradigm through the familiar JavaScript language.\"), mdx(\"h2\", {\n    \"id\": \"functional-programming-with-clojure\",\n    \"style\": {\n      \"position\": \"relative\"\n    }\n  }, mdx(\"a\", _extends({\n    parentName: \"h2\"\n  }, {\n    \"href\": \"#functional-programming-with-clojure\",\n    \"aria-label\": \"functional programming with clojure permalink\",\n    \"className\": \"anchor before\"\n  }), mdx(\"svg\", _extends({\n    parentName: \"a\"\n  }, {\n    \"aria-hidden\": \"true\",\n    \"focusable\": \"false\",\n    \"height\": \"16\",\n    \"version\": \"1.1\",\n    \"viewBox\": \"0 0 16 16\",\n    \"width\": \"16\"\n  }), mdx(\"path\", _extends({\n    parentName: \"svg\"\n  }, {\n    \"fillRule\": \"evenodd\",\n    \"d\": \"M4 9h1v1H4c-1.5 0-3-1.69-3-3.5S2.55 3 4 3h4c1.45 0 3 1.69 3 3.5 0 1.41-.91 2.72-2 3.25V8.59c.58-.45 1-1.27 1-2.09C10 5.22 8.98 4 8 4H4c-.98 0-2 1.22-2 2.5S3 9 4 9zm9-3h-1v1h1c1 0 2 1.22 2 2.5S13.98 12 13 12H9c-.98 0-2-1.22-2-2.5 0-.83.42-1.64 1-2.09V6.25c-1.09.53-2 1.84-2 3.25C6 11.31 7.55 13 9 13h4c1.45 0 3-1.69 3-3.5S14.5 6 13 6z\"\n  })))), \"Functional Programming with Clojure\"), mdx(\"p\", null, mdx(\"strong\", {\n    parentName: \"p\"\n  }, \"Simple Concurrency on the JVM\")), mdx(\"p\", null, \"Clojure is a robust, practical, and fast programming language with a set of useful features that together form a simple, coherent, and powerful tool.\"), mdx(\"h2\", {\n    \"id\": \"understanding-cloud-computing\",\n    \"style\": {\n      \"position\": \"relative\"\n    }\n  }, mdx(\"a\", _extends({\n    parentName: \"h2\"\n  }, {\n    \"href\": \"#understanding-cloud-computing\",\n    \"aria-label\": \"understanding cloud computing permalink\",\n    \"className\": \"anchor before\"\n  }), mdx(\"svg\", _extends({\n    parentName: \"a\"\n  }, {\n    \"aria-hidden\": \"true\",\n    \"focusable\": \"false\",\n    \"height\": \"16\",\n    \"version\": \"1.1\",\n    \"viewBox\": \"0 0 16 16\",\n    \"width\": \"16\"\n  }), mdx(\"path\", _extends({\n    parentName: \"svg\"\n  }, {\n    \"fillRule\": \"evenodd\",\n    \"d\": \"M4 9h1v1H4c-1.5 0-3-1.69-3-3.5S2.55 3 4 3h4c1.45 0 3 1.69 3 3.5 0 1.41-.91 2.72-2 3.25V8.59c.58-.45 1-1.27 1-2.09C10 5.22 8.98 4 8 4H4c-.98 0-2 1.22-2 2.5S3 9 4 9zm9-3h-1v1h1c1 0 2 1.22 2 2.5S13.98 12 13 12H9c-.98 0-2-1.22-2-2.5 0-.83.42-1.64 1-2.09V6.25c-1.09.53-2 1.84-2 3.25C6 11.31 7.55 13 9 13h4c1.45 0 3-1.69 3-3.5S14.5 6 13 6z\"\n  })))), \"Understanding Cloud Computing\"), mdx(\"p\", null, mdx(\"strong\", {\n    parentName: \"p\"\n  }, \"Amazon EC2, Google App Engine, and Microsoft Azure\")), mdx(\"p\", null, \"This Refcard will walk you through the basics, from where exactly clouds are located, to deciphering the differences between cloud service types (IaaS, PaaS, SaaS), and the key benefits you can expect to receive.\"), mdx(\"h2\", {\n    \"id\": \"design-systems\",\n    \"style\": {\n      \"position\": \"relative\"\n    }\n  }, mdx(\"a\", _extends({\n    parentName: \"h2\"\n  }, {\n    \"href\": \"#design-systems\",\n    \"aria-label\": \"design systems permalink\",\n    \"className\": \"anchor before\"\n  }), mdx(\"svg\", _extends({\n    parentName: \"a\"\n  }, {\n    \"aria-hidden\": \"true\",\n    \"focusable\": \"false\",\n    \"height\": \"16\",\n    \"version\": \"1.1\",\n    \"viewBox\": \"0 0 16 16\",\n    \"width\": \"16\"\n  }), mdx(\"path\", _extends({\n    parentName: \"svg\"\n  }, {\n    \"fillRule\": \"evenodd\",\n    \"d\": \"M4 9h1v1H4c-1.5 0-3-1.69-3-3.5S2.55 3 4 3h4c1.45 0 3 1.69 3 3.5 0 1.41-.91 2.72-2 3.25V8.59c.58-.45 1-1.27 1-2.09C10 5.22 8.98 4 8 4H4c-.98 0-2 1.22-2 2.5S3 9 4 9zm9-3h-1v1h1c1 0 2 1.22 2 2.5S13.98 12 13 12H9c-.98 0-2-1.22-2-2.5 0-.83.42-1.64 1-2.09V6.25c-1.09.53-2 1.84-2 3.25C6 11.31 7.55 13 9 13h4c1.45 0 3-1.69 3-3.5S14.5 6 13 6z\"\n  })))), \"Design systems\"), mdx(\"p\", null, \"The importance of UX is exponentially growing, which means that collaboration between design and development teams is a must. Design systems help foster this collaboration. In this Refcard, you\\u2019ll learn about the four stages of design-development collaboration, the anatomy of a design system, the benefits of using a design system, and the future of design systems.\"), mdx(\"h2\", {\n    \"id\": \"getting-started-with-docker\",\n    \"style\": {\n      \"position\": \"relative\"\n    }\n  }, mdx(\"a\", _extends({\n    parentName: \"h2\"\n  }, {\n    \"href\": \"#getting-started-with-docker\",\n    \"aria-label\": \"getting started with docker permalink\",\n    \"className\": \"anchor before\"\n  }), mdx(\"svg\", _extends({\n    parentName: \"a\"\n  }, {\n    \"aria-hidden\": \"true\",\n    \"focusable\": \"false\",\n    \"height\": \"16\",\n    \"version\": \"1.1\",\n    \"viewBox\": \"0 0 16 16\",\n    \"width\": \"16\"\n  }), mdx(\"path\", _extends({\n    parentName: \"svg\"\n  }, {\n    \"fillRule\": \"evenodd\",\n    \"d\": \"M4 9h1v1H4c-1.5 0-3-1.69-3-3.5S2.55 3 4 3h4c1.45 0 3 1.69 3 3.5 0 1.41-.91 2.72-2 3.25V8.59c.58-.45 1-1.27 1-2.09C10 5.22 8.98 4 8 4H4c-.98 0-2 1.22-2 2.5S3 9 4 9zm9-3h-1v1h1c1 0 2 1.22 2 2.5S13.98 12 13 12H9c-.98 0-2-1.22-2-2.5 0-.83.42-1.64 1-2.09V6.25c-1.09.53-2 1.84-2 3.25C6 11.31 7.55 13 9 13h4c1.45 0 3-1.69 3-3.5S14.5 6 13 6z\"\n  })))), \"Getting Started With Docker\"), mdx(\"p\", null, mdx(\"strong\", {\n    parentName: \"p\"\n  }, \"The De Facto Open-Source Containerization Solution\")), mdx(\"p\", null, \"In what seems like an instant, Docker has become the benchmark for organizations to automate infrastructure, isolate applications, maintain consistency, and improve resource utilizations. In this Refcard, learn how to run a container, explore several useful commands, and discover how to create local Docker machines.\"), mdx(\"h2\", {\n    \"id\": \"getting-started-with-microservices\",\n    \"style\": {\n      \"position\": \"relative\"\n    }\n  }, mdx(\"a\", _extends({\n    parentName: \"h2\"\n  }, {\n    \"href\": \"#getting-started-with-microservices\",\n    \"aria-label\": \"getting started with microservices permalink\",\n    \"className\": \"anchor before\"\n  }), mdx(\"svg\", _extends({\n    parentName: \"a\"\n  }, {\n    \"aria-hidden\": \"true\",\n    \"focusable\": \"false\",\n    \"height\": \"16\",\n    \"version\": \"1.1\",\n    \"viewBox\": \"0 0 16 16\",\n    \"width\": \"16\"\n  }), mdx(\"path\", _extends({\n    parentName: \"svg\"\n  }, {\n    \"fillRule\": \"evenodd\",\n    \"d\": \"M4 9h1v1H4c-1.5 0-3-1.69-3-3.5S2.55 3 4 3h4c1.45 0 3 1.69 3 3.5 0 1.41-.91 2.72-2 3.25V8.59c.58-.45 1-1.27 1-2.09C10 5.22 8.98 4 8 4H4c-.98 0-2 1.22-2 2.5S3 9 4 9zm9-3h-1v1h1c1 0 2 1.22 2 2.5S13.98 12 13 12H9c-.98 0-2-1.22-2-2.5 0-.83.42-1.64 1-2.09V6.25c-1.09.53-2 1.84-2 3.25C6 11.31 7.55 13 9 13h4c1.45 0 3-1.69 3-3.5S14.5 6 13 6z\"\n  })))), \"Getting Started With Microservices\"), mdx(\"p\", null, mdx(\"strong\", {\n    parentName: \"p\"\n  }, \"Design Patterns for Decomposing the Monolith\")), mdx(\"p\", null, \"Welcome to the world of microservices, where continuous deployment isn\\u2019t just an aspiration, but a reality. With microservices, you can ditch the complexities of monolithic architecture for the nimble and flexible approach that embraces the \\u201Cdo one thing, and do it well\\u201D mentality. In this article, you will learn key characteristics and benefits of microservices, as well as common patterns to help you get started.\"), mdx(\"h2\", {\n    \"id\": \"nodejs\",\n    \"style\": {\n      \"position\": \"relative\"\n    }\n  }, mdx(\"a\", _extends({\n    parentName: \"h2\"\n  }, {\n    \"href\": \"#nodejs\",\n    \"aria-label\": \"nodejs permalink\",\n    \"className\": \"anchor before\"\n  }), mdx(\"svg\", _extends({\n    parentName: \"a\"\n  }, {\n    \"aria-hidden\": \"true\",\n    \"focusable\": \"false\",\n    \"height\": \"16\",\n    \"version\": \"1.1\",\n    \"viewBox\": \"0 0 16 16\",\n    \"width\": \"16\"\n  }), mdx(\"path\", _extends({\n    parentName: \"svg\"\n  }, {\n    \"fillRule\": \"evenodd\",\n    \"d\": \"M4 9h1v1H4c-1.5 0-3-1.69-3-3.5S2.55 3 4 3h4c1.45 0 3 1.69 3 3.5 0 1.41-.91 2.72-2 3.25V8.59c.58-.45 1-1.27 1-2.09C10 5.22 8.98 4 8 4H4c-.98 0-2 1.22-2 2.5S3 9 4 9zm9-3h-1v1h1c1 0 2 1.22 2 2.5S13.98 12 13 12H9c-.98 0-2-1.22-2-2.5 0-.83.42-1.64 1-2.09V6.25c-1.09.53-2 1.84-2 3.25C6 11.31 7.55 13 9 13h4c1.45 0 3-1.69 3-3.5S14.5 6 13 6z\"\n  })))), \"Node.js\"), mdx(\"p\", null, mdx(\"strong\", {\n    parentName: \"p\"\n  }, \"Server-Side JavaScript for Backends, API Servers, and Web Apps\")), mdx(\"p\", null, \"Node.js is a JavaScript runtime that runs on top of Google\\u2019s open-source JavaScript engine called V8. Pairing JavaScript\\u2019s naturally event-driven, asynchronous coding style with non-blocking I/O libraries makes Node.js fast, lightweight, and efficient. This article introduces Node, explains how it works, and dives into its architecture. Learn how to install and use Node to its full potential and access a list of the most commonly used APIs.\"));\n}\n;\nMDXContent.isMDXComponent = true;","description":null,"canonicalUrl":null,"excerpt":"Refcard  is a collection of brief notes on a specific topic to aid in memorization. I have found a few useful refcards on the  DZone…","timeToRead":2,"banner":null}},"pageContext":{"slug":"/refcards","formatString":"DD.MM.YYYY"}},"staticQueryHashes":["3090400250","3090400250","318001574"]}